INTENT_NAME,UTTERANCES
INFO_FORGOT_PASSWORD,cant remember my password on this account
INFO_FORGOT_PASSWORD,how can i recover password online
INFO_FORGOT_PASSWORD,Password is forgotten
INFO_FORGOT_PASSWORD,what was my password
INFO_FORGOT_PASSWORD,remind me of my password
INFO_FORGOT_PASSWORD,What is the password of my account
INFO_FORGOT_PASSWORD,I need to remember my password
INFO_FORGOT_PASSWORD,How can I get my password
INFO_FORGOT_PASSWORD,Please help me access my account password
INFO_FORGOT_PASSWORD,can i have my password
INFO_FORGOT_PASSWORD,tell me my forgotten password
INFO_FORGOT_PASSWORD,I lost my password and need to get a new one
INFO_FORGOT_PASSWORD,Hi its me Erin Vieyra again so I cant figure out my password to my email what can i do
INFO_FORGOT_PASSWORD,Can you tell me how to recover my password
INFO_FORGOT_PASSWORD,password forgotten
INFO_FORGOT_PASSWORD,password please
INFO_FORGOT_PASSWORD,I cant remember my current password Can you help
INFO_FORGOT_PASSWORD,i forgot my password how do i reset
INFO_FORGOT_PASSWORD,I forgot the password for this account
INFO_FORGOT_PASSWORD,If you help me I can find my password
INFO_FORGOT_PASSWORD,How can i get a password if i forgot it
INFO_FORGOT_PASSWORD,Can you help me remember my password
INFO_FORGOT_PASSWORD,I forgot my password
INFO_FORGOT_PASSWORD,how do i retrieve my password
INFO_FORGOT_PASSWORD,System doesnt accept my password Am I entering a correct one
INFO_FORGOT_PASSWORD,Forgot my password
INFO_FORGOT_PASSWORD,What can I do if I cant remember my password
INFO_FORGOT_PASSWORD,My password doesnt work
INFO_FORGOT_PASSWORD,i have to reset my password
INFO_FORGOT_PASSWORD,i need password related assistance
INFO_FORGOT_PASSWORD,whats the password for this account
INFO_FORGOT_PASSWORD,i cant remmeber my password
INFO_FORGOT_PASSWORD,unable to remember my password
INFO_FORGOT_PASSWORD,Help me update my password because I forgot my password
INFO_FORGOT_PASSWORD,I forgot my password on this account
INFO_FORGOT_PASSWORD,how to recover my password
INFO_FORGOT_PASSWORD,could you help reset my password
INFO_FORGOT_PASSWORD,I am unable to remember my password
INFO_FORGOT_PASSWORD,need help to get password back
INFO_FORGOT_PASSWORD,I dont remember by password
INFO_FORGOT_PASSWORD,I forget what my password is
INFO_FORGOT_PASSWORD,I need a password hint because I forgot my password
INFO_FORGOT_PASSWORD,Can you please tell me my password
INFO_FORGOT_PASSWORD,How can I recover my password if I forget it
INFO_FORGOT_PASSWORD,I want to log in but dont know my password
INFO_FORGOT_PASSWORD,Are you able to tell me my password
INFO_FORGOT_PASSWORD,Password does not work
INFO_FORGOT_PASSWORD,Where can I reset my lost password
INFO_FORGOT_PASSWORD,I dont remember my password
INFO_FORGOT_PASSWORD,I need to know my password i forgot
INFO_FORGOT_PASSWORD,can you help me login as I forgot my password
INFO_FORGOT_PASSWORD,I think Ive got an incorrect password
INFO_FORGOT_PASSWORD,I might have forgotten my password
INFO_FORGOT_PASSWORD,I forgot the password on my account
INFO_FORGOT_PASSWORD,Ive forgotten my password
INFO_FORGOT_PASSWORD,dont know my password
INFO_FORGOT_PASSWORD,What do I do if I forget my password
INFO_FORGOT_PASSWORD,i dont know what my password is
INFO_FORGOT_PASSWORD,I know my user name but cant remember the password
INFO_FORGOT_PASSWORD,I dont remember what I set my password to
INFO_FORGOT_PASSWORD,i forgot the password for my account
INFO_FORGOT_USERID,can you find my user ID for me
INFO_FORGOT_USERID,Is there any way to get my User ID
INFO_FORGOT_USERID,Help I forgot my user ID
INFO_FORGOT_USERID,Forgotten my user ID
INFO_FORGOT_USERID,need help to get user id
INFO_FORGOT_USERID,I need my user ID
INFO_FORGOT_USERID,i suddenly forgot my user id
INFO_FORGOT_USERID,How can I find my user ID
INFO_FORGOT_USERID,I wish I could remember my user ID
INFO_FORGOT_USERID,I need to know my user ID as I have forgotten it
INFO_FORGOT_USERID,need help with user id
INFO_FORGOT_USERID,email me my user id
INFO_FORGOT_USERID,Can you give me my username for the website
INFO_FORGOT_USERID,cannot remember my user ID
INFO_FORGOT_USERID,I cant remember what mu user ID possibly could be
INFO_FORGOT_USERID,what is my user id
INFO_FORGOT_USERID,At waht case i get new user id for forgotem user id
INFO_FORGOT_USERID,how to recover user ID
INFO_FORGOT_USERID,User name
INFO_FORGOT_USERID,I want to login but I need my user ID first
INFO_FORGOT_USERID,I cant recall what my user ID is
INFO_FORGOT_USERID,forgot username
INFO_FORGOT_USERID,I want to know my user ID
INFO_FORGOT_USERID,I cannot remember my USer iD
INFO_FORGOT_USERID,How can I find what my user ID is
INFO_FORGOT_USERID,Can not remember my user ID for this account
INFO_FORGOT_USERID,dont know my user id
INFO_FORGOT_USERID,what is the steps i need to follow to find my user id
INFO_FORGOT_USERID,i need assistance to get my user id
INFO_FORGOT_USERID,can you tell me my user id
INFO_FORGOT_USERID,I am not able to remember my user id
INFO_FORGOT_USERID,i cant recall my user id
INFO_FORGOT_USERID,help me find my user ID
INFO_FORGOT_USERID,need help to find out my user ID
INFO_FORGOT_USERID,How can I get you to tel me my user ID
INFO_FORGOT_USERID,whats the user id for my account
INFO_FORGOT_USERID,i have forgotten my user id
INFO_FORGOT_USERID,whats my user ID
INFO_FORGOT_USERID,I need my user ID as soon as possible
INFO_FORGOT_USERID,need a reminder of my user ID
INFO_FORGOT_USERID,Could you help me locate my user ID
INFO_FORGOT_USERID,need my user id
INFO_FORGOT_USERID,Do not remember any user ID
INFO_FORGOT_USERID,i need the user id to my account
INFO_FORGOT_USERID,I seem to have forgotten my user ID
INFO_FORGOT_USERID,what is the name of my user id
INFO_FORGOT_USERID,what is this users userID
INFO_FORGOT_USERID,I want to log in and it says I need a user ID I dont know that Help
INFO_FORGOT_USERID,I need to find my user ID I dont know it and want to log on
INFO_FORGOT_USERID,Help me to recall my user ID
INFO_FORGOT_USERID,what is my user name
INFO_FORGOT_USERID,have to get user id forgot it
INFO_FORGOT_USERID,fogot my user id
INFO_FORGOT_USERID,whats my user id
INFO_FORGOT_USERID,what is user ID on the account sign up page
INFO_FORGOT_USERID,I lost my user ID
INFO_FORGOT_USERID,Please help me to find my user id
INFO_FORGOT_USERID,do not remember my user id
INFO_FORGOT_USERID,Can you help me find my user ID
INFO_FORGOT_USERID,what is my user id again
INFO_FORGOT_USERID,I thought I knew my user ID but I guess I dont
INFO_FORGOT_USERID,where can i find my user id
INFO_FORGOT_USERID,Help me with my user ID
INFO_FORGOT_USERID,cant get in with user id
INFO_FORGOT_USERID,I cannot recall my user ID
INFO_FORGOT_USERID,tell me my user ID
INFO_FORGOT_USERID,can i get my user id
INFO_FORGOT_USERID,whats user id
INFO_FORGOT_USERID,I need my User Id
INFO_FORGOT_USERID,I cant seem to recall my user ID
INFO_FORGOT_USERID,I need my user ID because I cant remember it
INFO_FORGOT_USERID,Is there any way to find my user ID because I forgot what it is
INFO_FORGOT_USERID,Could you send me what my user ID is
INFO_FORGOT_USERID,what is my username
INFO_FORGOT_USERID,Great I am have trouble logging in user ID
INFO_FORGOT_USERID,I have lost my username ID
INFO_FORGOT_USERID,I need help getting into my account because I dont remember my user ID
INFO_FORGOT_USERID,I thought I knew my user ID but I dont please help
INFO_FORGOT_USERID,I forgot my user ID can you give it to me
INFO_FORGOT_USERID,I dont remember my user ID
INFO_FORGOT_USERID,Where can I see what my user ID is
INFO_FORGOT_USERID,How do I find my user ID
INFO_FORGOT_USERID,can you help me with my user id
INFO_FORGOT_USERID,can you help me remember my user ID
INFO_FORGOT_USERID,Where can I find my user ID
INFO_FORGOT_USERID,I set up for automatic payment from my checking account So I want to cancel but I forgot my account login name and password
INFO_FORGOT_USERID,Help me remember my user ID
INFO_FORGOT_USERID,I cant access my account because I forgot my user ID
INFO_FORGOT_USERID,Can you give me my user ID
INFO_FORGOT_USERID,I dont know what my log in name is
INFO_FORGOT_USERID,i cant log in what is my user id
INFO_FORGOT_USERID,What is my current user ID
INFO_GAP_COVERAGE,I want a quote for GAP coverage
INFO_GAP_COVERAGE,Can I get a quote for GAP insurance
INFO_GAP_COVERAGE,gap insurance
INFO_GAP_COVERAGE,No gap only quote
INFO_GAP_COVERAGE,Do you offer GAP coverage
INFO_GAP_COVERAGE,can you tell me the qualifications my car needs to meet to qualify for the gap insurance endorsement on an auto policy
INFO_GAP_COVERAGE,Hey Abby I have taken GAP insurance with my Auto
INFO_GAP_COVERAGE,Can I buy GAP insurance from you
INFO_GAP_COVERAGE,I bought a new car and need to know if you sell GAP insurance
INFO_GEN_POLICY_COV_QUESTION,I have cut myself while cooking does my insurance policy cover this
INFO_GEN_POLICY_COV_QUESTION,Help explain me my policy coverage
INFO_GEN_POLICY_COV_QUESTION,there is something i need to know about my insurance
INFO_GEN_POLICY_COV_QUESTION,who should I call about my renters insurance
INFO_GEN_POLICY_COV_QUESTION,Can you help me Does our home owners insurance cover damage from Carpenter Ants We are not sure if we have any but I wanted to prepare if we do
INFO_GEN_POLICY_COV_QUESTION,Is my home covered in the event of a flood or natural disaster
INFO_GEN_POLICY_COV_QUESTION,Hi there I want to see if my auto insurance has a loss payable clause
INFO_GEN_POLICY_COV_QUESTION,I wanted to know something about jewelry claim under a renters insurance policy
INFO_GEN_POLICY_COV_QUESTION,Does my house insurance cover me for things broken by my children
INFO_GEN_POLICY_COV_QUESTION,I need to know what my policy covers
INFO_GEN_POLICY_COV_QUESTION,how much will my policy cover in case of theft
INFO_GEN_POLICY_COV_QUESTION,i have a question about coverage
INFO_GEN_POLICY_COV_QUESTION,Does my houseowners policy covers minor repair works in home
INFO_GEN_POLICY_COV_QUESTION,Does my home owners insurance cover a fallen tree
INFO_GEN_POLICY_COV_QUESTION,hail damaged the roof over the garage
INFO_GEN_POLICY_COV_QUESTION,I am renting a home how much coverage should I get
INFO_GEN_POLICY_COV_QUESTION,Does my homeowners policy include flood damage
INFO_GEN_POLICY_COV_QUESTION,Does my policy cover natural disasters
INFO_GEN_POLICY_COV_QUESTION,my policy coverage question
INFO_GEN_POLICY_COV_QUESTION,Does my policy include tornado damage
INFO_GEN_POLICY_COV_QUESTION,I am needing to find out about coverage on contents in our shed Specifically two atvs we have stored in there
INFO_GEN_POLICY_COV_QUESTION,Can damages caused when house is occupied by renters be claimed in this policy
INFO_GEN_POLICY_COV_QUESTION,whats not included in my policy
INFO_GEN_POLICY_COV_QUESTION,If I move does my insurance come with me
INFO_GEN_POLICY_COV_QUESTION,I am looking to get some info on my coverage
INFO_GEN_POLICY_COV_QUESTION,What is covered by my insurance
INFO_GEN_POLICY_COV_QUESTION,does my policy cover accidents
INFO_GEN_POLICY_COV_QUESTION,my home insurance policy lists a  medical expense section What exactly does that cover
INFO_GEN_POLICY_COV_QUESTION,does my policy cover removal of tree
INFO_GEN_POLICY_COV_QUESTION,I have doubts on my policy coverage
INFO_GEN_POLICY_COV_QUESTION,what is included in my policy
INFO_GEN_POLICY_COV_QUESTION,i have some questions about the policy
INFO_GEN_POLICY_COV_QUESTION,What is the cost of my homeowners policy
INFO_GEN_POLICY_COV_QUESTION,Does my policy cover the garage as well as the house
INFO_GEN_POLICY_COV_QUESTION,i need help understanding my insurance
INFO_GEN_POLICY_COV_QUESTION,Is the falling of my wall due to construction irregularities covered un my policy
INFO_GEN_POLICY_COV_QUESTION,does not my homeowners policy cover tree removal
INFO_GEN_POLICY_COV_QUESTION,does insurance cover  in damage
INFO_GEN_POLICY_COV_QUESTION,I would like to know more about what my policy covers please
INFO_GEN_POLICY_COV_QUESTION,Does my home owners insurance cover me if my dog bites someone
INFO_GEN_POLICY_COV_QUESTION,Is damage caused by an animal covered on my home owners policy
INFO_GEN_POLICY_COV_QUESTION,can you tell me more about my policy
INFO_GEN_POLICY_COV_QUESTION,the sewer line backed up into the basement
INFO_GEN_POLICY_COV_QUESTION,i have quesitons about my poicy
INFO_GEN_POLICY_COV_QUESTION,Do I have a maximum coverage amount per incident on my renters insurance
INFO_GEN_POLICY_COV_QUESTION,My house was struck by lightning is that covered in my policy
INFO_GEN_POLICY_COV_QUESTION,I have a question about my Home Owners Insurance Policy
INFO_GEN_POLICY_COV_QUESTION,My dog has bitten my brother does my policy covers his medical bills
INFO_GEN_POLICY_COV_QUESTION,Am I covered on my renters insurance if the landlord damages something while doing maintenance
INFO_GEN_POLICY_COV_QUESTION,my insurance question is about my policy coverage
INFO_GEN_POLICY_COV_QUESTION,i want to check all the information about my policy coverage
INFO_GEN_POLICY_COV_QUESTION,Can I have a list of the things my policy covers
INFO_GEN_POLICY_COV_QUESTION,Hi i was wondering what coverage I had related to my sump pump in my basement
INFO_GEN_POLICY_COV_QUESTION,could you help me understand what i am covered for
INFO_GEN_POLICY_COV_QUESTION,does my policy cover flooding
INFO_GEN_POLICY_COV_QUESTION,Does my policy include accidental damage cover
INFO_GEN_POLICY_COV_QUESTION,Will the policy cover modifications made
INFO_GEN_POLICY_COV_QUESTION,My home owners policy is confusing
INFO_GEN_POLICY_COV_QUESTION,dwelling limits
INFO_GEN_POLICY_COV_QUESTION,I currently have renters insurance Can you tell me if damage due to an aquarium would be covered My landlord wants proof to allow me to keep my fish when we move Thanks
INFO_GEN_POLICY_COV_QUESTION,Do I have termite insurance
INFO_GEN_POLICY_COV_QUESTION,My neighbors tree fell on my car and he has no insurance will that be covered by my policy
INFO_GEN_POLICY_COV_QUESTION,the neighbors tree fell on our roof
INFO_GEN_POLICY_COV_QUESTION,I have a statement here that I dont know what is being coveredthe policy is UY MUMBWI
INFO_GEN_POLICY_COV_QUESTION,How much can I claim for
INFO_GEN_POLICY_COV_QUESTION,what is covered with my renters policy
INFO_GEN_POLICY_COV_QUESTION,I dont understand my renters insurance
INFO_GEN_POLICY_COV_QUESTION,does the insurance have any nature clauses
INFO_GEN_POLICY_COV_QUESTION,I need to ask a question about my policy
INFO_GEN_POLICY_COV_QUESTION,Does my renters insurance cover damage due to the landlords negilgence
INFO_GEN_POLICY_COV_QUESTION,policy coverage question
INFO_GEN_POLICY_COV_QUESTION,Can you help me with a policy coverage question
INFO_GEN_POLICY_COV_QUESTION,if there is an earthquake how much damage will be covered
INFO_GEN_POLICY_COV_QUESTION,does my policy cover weather damages
INFO_GEN_POLICY_COV_QUESTION,If I move out of state will I still have coverage
INFO_GEN_POLICY_COV_QUESTION,Please help me understand my policy coverage
INFO_GEN_POLICY_COV_QUESTION,my homeowner policy cover for renavation the water tank
INFO_GEN_POLICY_COV_QUESTION,Is furniture damage covered under homeowner policy
INFO_GEN_POLICY_COV_QUESTION,if someone is injured on my front sidewalk am I responsible
INFO_GEN_POLICY_COV_QUESTION,if my house is struck by lightening what do I do
INFO_GEN_POLICY_COV_QUESTION,Id like to know about my policy
INFO_GEN_POLICY_COV_QUESTION,Do I have protection against vandalism
INFO_GEN_POLICY_COV_QUESTION,does my homeowners policy cover tree removal
INFO_GEN_POLICY_COV_QUESTION,Is mold damage included in my insurance
INFO_GEN_POLICY_COV_QUESTION,Can I get a detailed statement of everything covered by my policy please
INFO_GEN_POLICY_COV_QUESTION,does my policy cover acts of god
INFO_GEN_POLICY_COV_QUESTION,I have lost everything in my fridge because of a power outage am I covered
INFO_GEN_POLICY_COV_QUESTION,I have a query about my policy
INFO_GEN_POLICY_COV_QUESTION,I have questions about our homeowners insurance
INFO_GEN_POLICY_COV_QUESTION,Can I claim for repair of seepage from my roof
INFO_GEN_POLICY_COV_QUESTION,what does my policy actually cover
INFO_GEN_POLICY_COV_QUESTION,How long has my coverage been active
INFO_GEN_POLICY_COV_QUESTION,If my water heater leaks am I covered
INFO_GEN_POLICY_COV_QUESTION,Can i get an overview of what my policy covers
INFO_GEN_POLICY_COV_QUESTION,does my policy cover acts of God
INFO_GEN_POLICY_COV_QUESTION,Hello whats my policy coverage
INFO_GEN_POLICY_COV_QUESTION,does my policy cover fires
INFO_GEN_POLICY_COV_QUESTION,How do I determine coverage
INFO_GEN_POLICY_COV_QUESTION,i am really confused I am covered for accidental damage right
INFO_GEN_POLICY_COV_QUESTION,I have lost my luggage while travelling can I be reimbursed
INFO_GEN_POLICY_COV_QUESTION,Just curious what coverage do I have
INFO_GEN_POLICY_COV_QUESTION,Are damages caused by animals covered
INFO_GEN_POLICY_COV_QUESTION,Will ins cover tree damage
INFO_GEN_POLICY_COV_QUESTION,just a quick question about my insurance policy
INFO_GEN_POLICY_COV_QUESTION,I WANT TO KNOW MY CURRENT DWELLING LIMITS AND MY YEARLY PREMIUM
INFO_GEN_POLICY_COV_QUESTION,can you tell me if I have hazard insurance on my property my mortgage holder is asking for that
INFO_GEN_POLICY_COV_QUESTION,Can you clarify me on my policy coverage
INFO_GEN_POLICY_COV_QUESTION,Are my outbuildings included in my policy
INFO_GEN_POLICY_COV_QUESTION,if i cause damage due to my fault would i need to pay
INFO_GEN_POLICY_COV_QUESTION,We want to build a garage
INFO_GEN_POLICY_COV_QUESTION,My cat is dead I am covered
INFO_GEN_POLICY_COV_QUESTION,Can you help me with my policy
INFO_GEN_POLICY_COV_QUESTION,I have a question about my policy
INFO_GEN_POLICY_COV_QUESTION,i need some help with my policy coverage
INFO_GEN_POLICY_COV_QUESTION,does my policy cover death
INFO_GEN_POLICY_COV_QUESTION,what are all the treatment coverd by my current policy
INFO_GEN_POLICY_COV_QUESTION,Can I get coverage for my pets
INFO_GEN_POLICY_COV_QUESTION,Question Will my homeowners insurance cover damage to an rv that incurred the damage while it was parked in my driveway
INFO_GEN_POLICY_COV_QUESTION,Please help me figure out my policy
INFO_GEN_POLICY_COV_QUESTION,is there any insurance coverage for theft
INFO_GEN_POLICY_COV_QUESTION,Am I fully covered
INFO_GEN_POLICY_COV_QUESTION,Are there any dogs I am not covered by on my homeonwers insurance if my dog bites someone
INFO_GEN_POLICY_COV_QUESTION,Does my policy cover damage from hail
INFO_GEN_POLICY_COV_QUESTION,does my homeoners insuance cover wind damage
INFO_GEN_POLICY_COV_QUESTION,Am I covered for earthquake damage
INFO_GEN_POLICY_COV_QUESTION,A neighbors tree fell on our house Does our insurance cover that
INFO_GET_A_QUOTE_AUTO,Can you quote me on my auto insurance
INFO_GET_A_QUOTE_AUTO,I want to price insurance for my car
INFO_GET_A_QUOTE_AUTO,How do I get a quote for auto insurance
INFO_GET_A_QUOTE_AUTO,I got a new car and need a quote
INFO_GET_A_QUOTE_AUTO,Im buying a vehicle and would like a budgetary quote to add to my policy
INFO_GET_A_QUOTE_AUTO,Vehicle insurance quote
INFO_GET_A_QUOTE_AUTO,automobile insurance quotes
INFO_GET_A_QUOTE_AUTO,I need a quote for auto insurance
INFO_GET_A_QUOTE_AUTO,I would like to get a quote on auto coverage
INFO_GET_A_QUOTE_AUTO,Hi I have a question about car insurance We have four vehicles currently licensed in TN Two are kept in Wisconsin and two are kept in Tn Can we get car insurance thru amfam for the vehicles
INFO_GET_A_QUOTE_AUTO,Im looking to get auto insurance though you guys
INFO_GET_A_QUOTE_AUTO,I need a quote for an auto insurance
INFO_GET_A_QUOTE_AUTO,How much is it for the auto insurance
INFO_GET_A_QUOTE_AUTO,gimme an auto quote
INFO_GET_A_QUOTE_AUTO,can i get best rate from amfam for my auto policy
INFO_GET_A_QUOTE_AUTO,I want to get a price for my car
INFO_GET_A_QUOTE_AUTO,I want an auto insurance quote
INFO_GET_A_QUOTE_AUTO,Auto Insurance Quote
INFO_GET_A_QUOTE_AUTO,I would like to get an auto insurance plan
INFO_GET_A_QUOTE_AUTO,help me get quote for auto insurance
INFO_GET_A_QUOTE_AUTO,I am thinking about purchasing a new vehicle can you help me with a quote on what insurance would be on the new vehicle
INFO_GET_A_QUOTE_AUTO,Car insurance how much is it
INFO_GET_A_QUOTE_AUTO,I have a question on how much my rates would be on a  v mustang for a  year old male in high school
INFO_GET_A_QUOTE_AUTO,i need help finding auto insurance
INFO_GET_A_QUOTE_AUTO,I am thinking of buying a new car and need a quote for auto insurance
INFO_GET_A_QUOTE_AUTO,Cost for my car insurance
INFO_GET_A_QUOTE_AUTO,do you sell car insurance
INFO_GET_A_QUOTE_AUTO,i am trying to see if i can get a quote for an auto well for  autos
INFO_GET_A_QUOTE_AUTO,I would like to get a quote on car insurance for myself for a car that I will be getting in Aug
INFO_GET_A_QUOTE_AUTO,I need a car insurance quote
INFO_GET_A_QUOTE_AUTO,Can I get a quote on car insurance
INFO_GET_A_QUOTE_AUTO,Can I filter automobile quotes by cost or price
INFO_GET_A_QUOTE_AUTO,auto insurance policy prices
INFO_GET_A_QUOTE_AUTO,I do not have a car yet but I am looking to buy one Im trying to see if there is a way to get a quote for car insurance like a average quote for full coverage
INFO_GET_A_QUOTE_AUTO,I was wondering if you could give me rough quote on a new vehicle I dont have the VIN number
INFO_GET_A_QUOTE_AUTO,Quote for my automobile
INFO_GET_A_QUOTE_AUTO,I would like to get a quote on auto insurance
INFO_GET_A_QUOTE_AUTO,want auto insurance quote
INFO_GET_A_QUOTE_AUTO,i want to get a quote on a car
INFO_GET_A_QUOTE_AUTO,i want a quote for auto insurance
INFO_GET_A_QUOTE_AUTO,How can I get a quote for car insurance
INFO_GET_A_QUOTE_AUTO,can you send me the quote for auto insurance
INFO_GET_A_QUOTE_AUTO,I need a quote on car insurance
INFO_GET_A_QUOTE_AUTO,help me with auto ins quote
INFO_GET_A_QUOTE_AUTO,Hello Abby can you please help me to get a perfect quote for my car
INFO_GET_A_QUOTE_AUTO,I need insurance for my wifes car can you get me a quote
INFO_GET_A_QUOTE_AUTO,I would like to get a new auto policy
INFO_GET_A_QUOTE_AUTO_NONOWNER,Do you sell insurance for non owner for auto
INFO_GET_A_QUOTE_AUTO_NONOWNER,nonowner auto insurance quote
INFO_GET_A_QUOTE_AUTO_NONOWNER,Hi I got a question I just want to know if you guys have nonowners Auto Insurance
INFO_GET_A_QUOTE_AUTO_NONOWNER,non owner insurance
INFO_GET_A_QUOTE_AUTO_NONOWNER,quote for nonowner auto insurance
INFO_GET_A_QUOTE_AUTO_NONOWNER,Can I get a quote for non owner car insurance
INFO_GET_A_QUOTE_AUTO_NONOWNER,does your company offer car insurance for nonowners
INFO_GET_A_QUOTE_CFR,Get me the quote for business owners insurance policies
INFO_GET_A_QUOTE_CFR,How much can I expect to pay for business insurance
INFO_GET_A_QUOTE_CFR,Could you give me a quote on a policy for some business insurance
INFO_GET_A_QUOTE_CFR,What are the quotes are available for business insurance
INFO_GET_A_QUOTE_CFR,My business needs insurance What would it cost
INFO_GET_A_QUOTE_CFR,I need a quote for a business owners policy
INFO_GET_A_QUOTE_CFR,I am the owner of a beauty parlor I need some quotes for a business policy
INFO_GET_A_QUOTE_CFR,Do you have a good quote for workers comp insurance
INFO_GET_A_QUOTE_CFR,My business needs insurance Can you please get a quote
INFO_GET_A_QUOTE_CFR,What do I need to do to get a quote for business insurance
INFO_GET_A_QUOTE_CFR,Id like to get a quote for my business insurance
INFO_GET_A_QUOTE_CFR,Get me the quote for business owners insurance
INFO_GET_A_QUOTE_CFR,Can you give me quote for my business insurance
INFO_GET_A_QUOTE_CFR,Could you give me a policy quote for some business insurance
INFO_GET_A_QUOTE_CFR,I own a small business Can I get an insurance quote for this
INFO_GET_A_QUOTE_CFR,I would like information regarding a quote for my business insurance
INFO_GET_A_QUOTE_CFR,Who can provide me quote for my business insurance
INFO_GET_A_QUOTE_CFR,Who do I talk to to get quote for business insurance
INFO_GET_A_QUOTE_CFR,I need a business insurance quote
INFO_GET_A_QUOTE_CFR,Can you tell me a quote for business insurance
INFO_GET_A_QUOTE_CFR,Direct me to places where I can get quotes for business insurance
INFO_GET_A_QUOTE_CFR,Do you insure catering businesses
INFO_GET_A_QUOTE_CFR,How can I get a insurance quote for my business
INFO_GET_A_QUOTE_CFR,I own a business how can I get an insurance quote
INFO_GET_A_QUOTE_CFR,I need to get a quote of my business insurance
INFO_GET_A_QUOTE_CFR,I own several rental properties I want to get a quote
INFO_GET_A_QUOTE_CFR,I own several rental properties I need to get a quote
INFO_GET_A_QUOTE_CFR,What quotes do you offer for businesses
INFO_GET_A_QUOTE_CFR,What are your policies for business owners Can you give me a quote
INFO_GET_A_QUOTE_CFR,how much is it to insure my business with you
INFO_GET_A_QUOTE_CFR,I need a quote for my business insurance
INFO_GET_A_QUOTE_CFR,Can you quote me for workers comp insurance
INFO_GET_A_QUOTE_CFR,I need a quote for business insurance
INFO_GET_A_QUOTE_CFR,Get me the quote for business insurance policies
INFO_GET_A_QUOTE_CFR,Are you able to get me an insurance quote for my business
INFO_GET_A_QUOTE_CFR,I want a quote for my business insurance
INFO_GET_A_QUOTE_CFR,Could you please get me a business insurance quote
INFO_GET_A_QUOTE_CFR,I am a business owner and I am looking for business insuranceCan you provide me quotes
INFO_GET_A_QUOTE_CFR,Can you give me a quote for business insurance
INFO_GET_A_QUOTE_CFR,I want to get an insurance quote for my business
INFO_GET_A_QUOTE_CFR,get the quote for the business insurance
INFO_GET_A_QUOTE_CFR,Can I have a business insurance quote
INFO_GET_A_QUOTE_CFR,Can you provide me with a quote for my business insurance
INFO_GET_A_QUOTE_CFR,What details do you need for a business insurance policy
INFO_GET_A_QUOTE_CFR,Get me information about a quote for my business insurance
