INTENT_NAME,UTTERANCES
INFO_OPERATING_AREA,Are the insurances available in all the nation
INFO_OPERATING_AREA,I need to know what states you sell insurance out of
INFO_OPERATING_AREA,What states are eligible with your insurance plans
INFO_OPERATING_AREA,Please tell me the state where youu offer insuranece
INFO_OPERATING_AREA,Does it matter which state im in to get your insurance
INFO_OPERATING_AREA,Which is the primary state you give your insurance coverage
INFO_OPERATING_AREA,Can I buy insurance from which state
INFO_OPERATING_AREA,What states are available for your insurance plan
INFO_OPERATING_AREA,Can I get insurance in this state
INFO_OPERATING_CO,Is your company the same company as American insurance
INFO_OPERATING_CO,What is the name of your company
INFO_OPERATING_CO,Are you American Family Standard Insurance
INFO_OPERATING_CO,Could you list the names of all of your various companies for me
INFO_OPERATING_CO,What are the list of names that your company goes by
INFO_OPERATING_CO,Which companies do you operate
INFO_OPERATING_CO,Would you mind giving me the names of your companies
INFO_OPERATING_CO,Please list all the companies in your group
INFO_OPERATING_CO,What are all of your companies names
INFO_OPERATING_CO,What are the other companies under American Family Insurance
INFO_OPERATING_CO,Is American Standard Insurance one of your companies
INFO_OPERATING_CO,I was wondering if American Family Life Insurance is your company
INFO_OPERATING_CO,What other names does your company go by
INFO_OPERATING_CO,Can you list your company names
INFO_OPERATING_CO,Do you have a company that goes by American Family Mutual Insurance SI
INFO_OPERATING_CO,Is American Life insurance one of your company names
INFO_OPERATING_CO,Tell me the names of all of your companies
INFO_OPERATING_CO,Are you also known as Family American insurance of Ohio
INFO_OPERATING_CO,I would like to know the names of your companies
INFO_OPERATING_CO,What are the names of your companies
INFO_OPERATING_CO,What are your companies
INFO_OPERATING_CO,Please specify which companies you operate
INFO_OPERATING_CO,What are the name of your companies
INFO_OPERATING_CO,What companies operate under American Family
INFO_OPERATING_CO,What are all the names of your differnet companies
INFO_OPERATING_CO,I need to know the names of all your companies
INFO_OPERATING_CO,Please me have the names of your companies
INFO_OPERATING_CO,Does your company go by Family insurance
INFO_OPERATING_CO,Tell me which companies you operate
INFO_OPERATING_CO,Is American Life Insurance your company
INFO_OPERATING_CO,How many names does your company have
INFO_OPERATING_CO,can you company go by another name
INFO_PAPERLESS_DOCS_SETUP,Show me how to set up online billing
INFO_PAPERLESS_DOCS_SETUP,online billing set up please
INFO_PAPERLESS_DOCS_SETUP,so my billing stated says that if I dont go paperless ill be charged  next billing
INFO_PAPERLESS_DOCS_SETUP,set up online billing
INFO_PAPERLESS_DOCS_SETUP,needed to get paperless bills
INFO_PAPERLESS_DOCS_SETUP,set up electronic billing for my transactions
INFO_PAPERLESS_DOCS_SETUP,i am trying to set up paperless billing
INFO_PAPERLESS_DOCS_SETUP,Can you help me sign up for online billing
INFO_PAPERLESS_DOCS_SETUP,Please set up online billing
INFO_PAPERLESS_DOCS_SETUP,I need help to set up electronic billing
INFO_PAPERLESS_DOCS_SETUP,where can I signup to become paperless
INFO_PAPERLESS_DOCS_SETUP,Im ready to activate paperless billing
INFO_PAPERLESS_DOCS_SETUP,Please stop sending me paper bills
INFO_PAPERLESS_DOCS_SETUP,trying to go paperless
INFO_PAPERLESS_DOCS_SETUP,It tells me I can do online billing how would I do that
INFO_PAPERLESS_DOCS_SETUP,i want to change to paperless billing
INFO_PAPERLESS_DOCS_SETUP,Sign me up for electronic billing now
INFO_PAPERLESS_DOCS_SETUP,Set up online billing for me
INFO_PAPERLESS_DOCS_SETUP,I dont want to receive a paper bill anymore
INFO_PAPERLESS_DOCS_SETUP,I wish to start online billing
INFO_PAPERLESS_DOCS_SETUP,my agent tells me I must sent up an e statement for billing in order to avoid the administrative fee which is going up to  Can you help
INFO_PAPERLESS_DOCS_SETUP,How do I set up online billing
INFO_PAPERLESS_DOCS_SETUP,I want to register for online billing
INFO_PAPERLESS_DOCS_SETUP,tell me how to go paperless
INFO_PAPERLESS_DOCS_SETUP,show me how to start online billing
INFO_PAPERLESS_DOCS_SETUP,online billing setup
INFO_PAPERLESS_DOCS_SETUP,how can i setup paperless billing
INFO_PAPERLESS_DOCS_SETUP,Im trying to set up my paperless discount and it wont let me
INFO_PAPERLESS_DOCS_SETUP,i need to set up for paperless billing
INFO_PAPERLESS_DOCS_SETUP,I was told to sign up for paperless billing but I keep getting paper bills Can you help
INFO_PAPERLESS_DOCS_SETUP,I want to know how to get set up with online billing
INFO_PAPERLESS_DOCS_SETUP,i want enable online billing option
INFO_PAPERLESS_DOCS_SETUP,can you set up online billing
INFO_PAPERLESS_DOCS_SETUP,Where can I find a way to check go paperless on the Amfam app from my iPhone
INFO_PAPERLESS_DOCS_SETUP,how do I setup paperless billing
INFO_PAPERLESS_DOCS_SETUP,I want to set up paperless billing
INFO_PAPERLESS_DOCS_SETUP,I want to get into online billing
INFO_PAPERLESS_DOCS_SETUP,in which section of my account I can apply for online billing
INFO_PAPERLESS_DOCS_SETUP,I want to get my bills online
INFO_PAPERLESS_DOCS_SETUP,online billing setup please
INFO_PAPERLESS_DOCS_SETUP,i want to receive my bill via email
INFO_PAPERLESS_DOCS_SETUP,I want to go to paperless billing statement
INFO_PAPERLESS_DOCS_SETUP,I need to set up online billing
INFO_PAPERLESS_DOCS_SETUP,Sign up for online billing
INFO_PAPERLESS_DOCS_SETUP,I dont want to receive paper bills
INFO_PAPERLESS_DOCS_SETUP,set up my online billing
INFO_PAPERLESS_DOCS_SETUP,I want to get my bills through email or sent to my online account
INFO_PAPERLESS_DOCS_SETUP,how do i sign up for online billing
INFO_PAPERLESS_DOCS_SETUP,Can I change my billing from paper bill to online
INFO_PAPERLESS_DOCS_SETUP,can you setup online billing
INFO_PAPERLESS_DOCS_SETUP,Switch my billing statements to online
INFO_PAPERLESS_DOCS_SETUP,I want to setup electronic billinng for my insurance
INFO_PAPERLESS_DOCS_SETUP,i need to set up my online billing
INFO_PAPERLESS_DOCS_SETUP,how can i set up my electronic billing
INFO_PAPERLESS_DOCS_SETUP,sign up for electronic billing
INFO_PAPERLESS_DOCS_SETUP,how to go paperless billing
INFO_PAPERLESS_DOCS_SETUP,how do i change to paperless billing
INFO_PAPERLESS_DOCS_SETUP,will you sign me up only for electronic billing
INFO_PAPERLESS_DOCS_SETUP,sign up online billing
INFO_PAPERLESS_DOCS_SETUP,I want to enroll in online billing
INFO_PAPERLESS_DOCS_SETUP,please setup online billing
INFO_PAPERLESS_DOCS_SETUP,Id like to turn on paperless billing
INFO_PAPERLESS_DOCS_SETUP,I am trying to set up online billing
INFO_PAPERLESS_DOCS_SETUP,how do i update my account to receive paperless billing
INFO_PAPERLESS_DOCS_SETUP,please set up for online billing for me
INFO_PAPERLESS_DOCS_SETUP,i want to go paperless
INFO_PAPERLESS_DOCS_SETUP,Help me to set up online billing
INFO_PAPERLESS_DOCS_SETUP,how can i sign up for online billing
INFO_PAPERLESS_DOCS_SETUP,i dont want a paper bill anymore
INFO_PAPERLESS_DOCS_SETUP,SET UP PAPERLESS
INFO_PAPERLESS_DOCS_SETUP,I have been told by my agent that we are going to a paperless billing and the email I gave originally online is one I do not use anymore How do I get that updated
INFO_PAPERLESS_DOCS_SETUP,I want paperless billing
INFO_PAPERLESS_DOCS_SETUP,I need to learn how to set up online billing
INFO_PAPERLESS_DOCS_SETUP,Hi Linda Id like to change my billing from paper statements to email How do I do that
INFO_PAPERLESS_DOCS_SETUP,hi I would like to go paperless on my account
INFO_PAPERLESS_DOCS_SETUP,I want to make my account have online billing
INFO_PAPERLESS_DOCS_SETUP,i want to set up online billing
INFO_PAPERLESS_DOCS_SETUP,Online bill payment set up
INFO_PAPERLESS_DOCS_SETUP,Please change my billing into online
INFO_PAPERLESS_DOCS_SETUP,I want to have my bills sent to my email since my agent is no longer sending me bills through the mail How do I do this
INFO_PAPERLESS_DOCS_SETUP,I would like to enroll in paperless statements and cant find where I can do that on my account
INFO_PAPERLESS_DOCS_SETUP,What do I need to do to stop getting paper billing statements
INFO_PAPERLESS_DOCS_SETUP,stop paper billing
INFO_PAPERLESS_DOCS_SETUP,How do I stop paper billing so I will stop getting charged an extra  for you guys to mail my paper bill to me
INFO_PAPERLESS_DOCS_SETUP,Can I signup for paperless billing
INFO_PAPERLESS_DOCS_SETUP,Electronic billing set up please
INFO_PAPERLESS_DOCS_SETUP,I need to set up paperless billing
INFO_PAPERLESS_DOCS_SETUP,Id like to sign up for electronic billing
INFO_PAPERLESS_DOCS_SETUP,How can I Go paperless
INFO_PAPERLESS_DOCS_SETUP,where do I go to find out about online billing
INFO_PAPERLESS_DOCS_SETUP,Hello I would like set up my account so that I no longer receive paper billing statements
INFO_PAPERLESS_DOCS_SETUP,Help me to get set up with online billing
INFO_PAPERLESS_DOCS_SETUP,how do I get online blling set up
INFO_PAPERLESS_DOCS_SETUP,Can you help me set up online billing
INFO_PAPERLESS_DOCS_SETUP,I want to use online billing
INFO_PAPERLESS_DOCS_SETUP,I need to sign up for paperless billing
INFO_PAPERLESS_DOCS_SETUP,I do not want bills in my mail What can I do
INFO_PAPERLESS_DOCS_SETUP,where online can i change to paperless statements
INFO_PAPERLESS_DOCS_SETUP,register for electronic billing
INFO_PAPERLESS_DOCS_SETUP,help me get started with electronic billing
INFO_PAPERLESS_DOCS_STOP,can i get rid of my paperless billing
INFO_PAPERLESS_DOCS_STOP,I want to stop paperless billing and receive mailings for accounts
INFO_PAPERLESS_DOCS_STOP,send me paper bills
INFO_PAPERLESS_DOCS_STOP,Paperless billing irritates me how can k get the old one back
INFO_PAPERLESS_DOCS_STOP,Can I have my statements mailed
INFO_PAPERLESS_DOCS_STOP,how do i go about receiving paper bills
INFO_PAPERLESS_DOCS_STOP,get my every bills in paper printed copy
INFO_PAPERLESS_DOCS_STOP,cancel online billing
INFO_PAPERLESS_DOCS_STOP,I am not happy with paperless billing
INFO_PAPERLESS_DOCS_STOP,i would like to get paper bills again
INFO_PAPERLESS_DOCS_STOP,Stop online billing
INFO_PAPERLESS_DOCS_STOP,Switch my online billing to paper billing
INFO_PAPERLESS_DOCS_STOP,want to cancel paper billing
INFO_PAPERLESS_DOCS_STOP,how can i cancel my online billing
INFO_PAPERLESS_DOCS_STOP,How to end online billing
INFO_PAPERLESS_DOCS_STOP,can i use paper billing instead of online billing
INFO_PAPERLESS_DOCS_STOP,I dont want to be enrolled in online billing anymore
INFO_PAPERLESS_DOCS_STOP,Cancel my online billing
INFO_PAPERLESS_DOCS_STOP,I do not want my bill by email
INFO_PAPERLESS_DOCS_STOP,cancel online billing and mail me my bills
INFO_PAPERLESS_DOCS_STOP,How can I change from paperless billing
INFO_PAPERLESS_DOCS_STOP,I cant access online bills anymore
INFO_PAPERLESS_DOCS_STOP,I want my bills mailed to me
INFO_PAPERLESS_DOCS_STOP,send my bill by mail
INFO_PAPERLESS_DOCS_STOP,can I cancel my online billing please
INFO_PAPERLESS_DOCS_STOP,How do I begin receiving paper bills again
INFO_PAPERLESS_DOCS_STOP,I want to stop online billing
INFO_PAPERLESS_DOCS_STOP,i want to receive my bills via the mail
INFO_PAPERLESS_DOCS_STOP,I want to get bills in the mail and not online
INFO_PAPERLESS_DOCS_STOP,stop sending me bills online
INFO_PAPERLESS_DOCS_STOP,can i cancel paperless billing
INFO_PAPERLESS_DOCS_STOP,start paper billing
INFO_PAPERLESS_DOCS_STOP,How to move to paper billing
INFO_PAPERLESS_DOCS_STOP,Go back to getting paper bills
INFO_PAPERLESS_DOCS_STOP,Please change my billing to mail
INFO_PAPERLESS_DOCS_STOP,cancel my email statements
INFO_PAPERLESS_DOCS_STOP,Stop billing me online
INFO_PAPERLESS_DOCS_STOP,want only printed bills for payment
INFO_PAPERLESS_DOCS_STOP,I want to go back to paper billing statement
INFO_PAPERLESS_DOCS_STOP,How do I cancel online billing
INFO_PAPERLESS_DOCS_STOP,I want to cancel bills online
INFO_PAPERLESS_DOCS_STOP,why am I not recieving paper bills
INFO_PAPERLESS_DOCS_STOP,It appears that some of my billing accounts have been set to paperless I need them to mail out paper bills How can I make that change
INFO_PAPERLESS_DOCS_STOP,Switch to paper bill
INFO_PAPERLESS_DOCS_STOP,Cancel onling billing and change to regular mail
INFO_PAPERLESS_DOCS_STOP,I need my bill sent by mail
INFO_PAPERLESS_DOCS_STOP,Please cancel my online billing
INFO_PAPERLESS_DOCS_STOP,I need to cancel online invoices and be sent a paper bill
INFO_PAPERLESS_DOCS_STOP,mail me bills
INFO_PAPERLESS_DOCS_STOP,I want to stop paperless billing
INFO_PAPERLESS_DOCS_STOP,stop my online billing
INFO_PAPERLESS_DOCS_STOP,How to cancel online billing
INFO_PAPERLESS_DOCS_STOP,tell me how to cancel online billing
INFO_PAPERLESS_DOCS_STOP,Online bills are too hard to use
INFO_PAPERLESS_DOCS_STOP,Please send only paper bills
INFO_PAPERLESS_DOCS_STOP,I would like to cancel online billing
INFO_PAPERLESS_DOCS_STOP,stop email statements
INFO_PAPERLESS_DOCS_STOP,Can I go back to paper billing
INFO_PAPERLESS_DOCS_STOP,I need to get paper bills
INFO_PAPERLESS_DOCS_STOP,i want to cancel my paperless billing
INFO_PAPERLESS_DOCS_STOP,can i stop paperless billing
INFO_PAPERLESS_DOCS_STOP,How on earth does one figure out how to get the darn system to start sending me paper bills again
INFO_PAPERLESS_DOCS_STOP,I want to receive a hard copy of my bill
INFO_PAPERLESS_DOCS_STOP,Get normal mail billing instead of paperless billing
INFO_PAPERLESS_DOCS_STOP,Please stop my online billing
INFO_PAPERLESS_DOCS_STOP,add regular mail billing instead of online billing
INFO_PAPERLESS_DOCS_STOP,Cancel my billing online
INFO_PAPERLESS_DOCS_STOP,I really dont like the online billing option
INFO_PAPERLESS_DOCS_STOP,I need my bills mailed to me
INFO_PAPERLESS_DOCS_STOP,I want to stop using paperless billing
INFO_PAPERLESS_DOCS_STOP,I need to get bills in the mail
INFO_PAPERLESS_DOCS_STOP,I want to cancel online billing
INFO_PAPERLESS_DOCS_STOP,Stop online billing and continue paper billing
INFO_PAPERLESS_DOCS_STOP,Do you have any idea how to get papered billing back
INFO_PAPERLESS_DOCS_STOP,I want to get rid of online bills
INFO_PAPERLESS_DOCS_STOP,I do not want these electronic statementstoo confusingI want paper statements
INFO_PAPERLESS_DOCS_STOP,how do i stop online billing
INFO_PAPERLESS_DOCS_STOP,What are the option of cancel online bill
INFO_PAPERLESS_DOCS_STOP,I want the papered billing back asap
INFO_PAPERLESS_DOCS_STOP,Id like my bills mailed from now on
INFO_PAPERLESS_DOCS_STOP,cancel my paperless billing
INFO_PAPERLESS_DOCS_STOP,Id like to know how to go back to having our billing statement mailed to us rather than electronic billing
INFO_PAPERLESS_DOCS_STOP,Give me paper bills again like before
INFO_PAPERLESS_DOCS_STOP,stop electronic billing
INFO_PAPERLESS_DOCS_STOP,send through mail bills again
INFO_PAPERLESS_DOCS_STOP,I accidentally signed up for paperless documents I would like to still receive my insurance card and policy renewals in the mail How do I do that
INFO_PAPERLESS_DOCS_STOP,Please cancel online billing
INFO_PAPERLESS_DOCS_STOP,cancel online biling
INFO_PAPERLESS_DOCS_STOP,I dont want paperless billing
INFO_PAPERLESS_DOCS_STOP,How can I start receiving billing and statements via USPS
INFO_PAPERLESS_DOCS_STOP,Cancel paperless billing
INFO_PAPERLESS_DOCS_STOP,Cancel online bills for me
INFO_PAPERLESS_DOCS_STOP,I want to get bills in the mail
INFO_PAPERLESS_DOCS_STOP,I want to recieve bills in the mail
INFO_PAPERLESS_DOCS_STOP,Please send my bill in the mail from now on
INFO_PAPERLESS_DOCS_STOP,I want paper bills
INFO_PAPERLESS_DOCS_STOP,get paper bills in mail
INFO_PAPERLESS_DOCS_STOP,i need to get paper bills again
INFO_PAPERLESS_DOCS_STOP,No more online bills
INFO_PAPERLESS_DOCS_STOP,II dont get any kind of bill how can I get a bill in the mail
INFO_PAPERLESS_MAIL,Can I get my policies and other documents electronically and my bill in the mail
INFO_PAPERLESS_MAIL,If I go paperless will my monthly bills go from being mailed to being emailed
INFO_PAPERLESS_MAIL,Could you explain what happens to my paper bills if I sign up for paperless billing
INFO_PAPERLESS_MAIL,If I go for the paperless option will I still get bills by mail
INFO_PAPERLESS_MAIL,setting up paperless documents will I still get a paper bill
INFO_PAPERLESS_MAIL,I want to go paperless but I still want just my bills delivered by postal mail
INFO_PAPERLESS_MAIL,I have asked for electronic bill can I get paper bill also
INFO_PAPERLESS_MAIL,How do I get my bills mailed to me again after I signed up for paperless bills
INFO_PAPERLESS_MAIL,Will you send me paper bills once I sign up for paperless documents
INFO_PAPERLESS_MAIL,Do you send out an actual copy of the bill in the mail if Im a paperless customer
INFO_PAPERLESS_MAIL,is that possible to get paper bills in the mail if I sign up for paperless documents still
INFO_PAPERLESS_MAIL,Will I still get all of my bills in the mail if I sign up for paperless
INFO_PAPERLESS_MAIL,Can I get paperless bills in the mail if I sign up for paperless documents
INFO_PAPERLESS_MAIL,Could I get both electronic copies and paper copies of my bill
INFO_PAPERLESS_MAIL,Is it possible to get bills in the mail after signing up for paperless documents
INFO_PAPERLESS_MAIL,If I sign up to go paperless what will hapen to my montly bills that I get in the mail
INFO_PAPERLESS_MAIL,Do I still get a hard copy of my bill when I sign up for paperless
INFO_PAPERLESS_MAIL,Is there a way I can go paperless but still have just my bills sent to me in the mail
INFO_PAPERLESS_MAIL,Need paper bills but signed up for paperless documents
INFO_PAPERLESS_MAIL,Will my bills stop coming in the mail if I go paperless
INFO_PAPERLESS_MAIL,What happens to my bills sent regular mail if I sign up for paperless
INFO_PAPERLESS_MAIL,I want to sign up for paperless will I still be able to have my bills mailed to me
INFO_PAPERLESS_MAIL,Will my bills no longer be mailed if I go paperless
INFO_PAPERLESS_MAIL,Even though I signed up for paperless documents I want to receive my bills in the mail Is that possible
INFO_PAPERLESS_MAIL,Will I still get paper bills in my mail if I sign up for paperless documents
INFO_PAPERLESS_MAIL,Can I receive documents both electronically and in the mail
INFO_PAPERLESS_MAIL,How to get a paper copy of my bill mailed to me
INFO_PAPERLESS_MAIL,How do I make everything but my bills sent by email
INFO_PAPERLESS_MAIL,Do customers of paperless billing still get bills in the mail
INFO_PAPERLESS_MAIL,Can I get both electronic and paper bill
INFO_PAPERLESS_MAIL,Does signing up for paperless mean that I cant get my bills in the mail anymore
INFO_PAPERLESS_MAIL,If I go paperless is it possible to still have just my bills delivered by postal mail
INFO_PAPERLESS_MAIL,If I go paperless will I still get a bill in the mail
INFO_PAPERLESS_MAIL,I signed up for paperless documents Can I still get my bills mailed to me
INFO_PAPERLESS_MAIL,Can I receive bills both on my email and paper form through mail
INFO_PAPERLESS_MAIL,still is there possibility to get paper bills in the mail if I sign up for paperless documents
INFO_PAPERLESS_MAIL,If I sign up to get my bills electronically will I still receive paper bills too
INFO_PAPERLESS_MAIL,Id like to have my bills come by regular mail but for everything else I want to go paperless
INFO_PAPERLESS_MAIL,I signed up for electronic bills Can I still get a copy mailed to me
INFO_PAPERLESS_MAIL,If I sign up for paperless documents can you still mail me my bill
INFO_PAPERLESS_MAIL,I signed up for paperless billing do I still get a bill in the mail
INFO_PAPERLESS_MAIL,Will I still get paper bills in the mail if I sign up for paperless documents
INFO_PAPERLESS_MAIL,Do you know if I can get my paper bills if I sign up for electronic billing
INFO_PAPERLESS_MAIL,I want a bill mailed to me Can I get one even though I signed up for electric bills
INFO_PAPERLESS_MAIL,What do I have to do to make sure that my bills are mailed to me by postal mail if I sign up for paperless statements
INFO_PAY_LIFE_INS,How to pay life insurance bill
INFO_PAY_LIFE_INS,How can I make a payment on my life insurance
INFO_PAY_LIFE_INS,Can I pay my life insurance bill
INFO_PAY_LIFE_INS,Pay life insurance premium
INFO_PAY_LIFE_INS,Make payment on life insurance bill
INFO_PAY_LIFE_INS,Can I have some assistance in submitting a payment for my life insurance
INFO_PAY_LIFE_INS,Pay life insurance coverage amount due
INFO_PAY_LIFE_INS,Help me make a life insurance payment
INFO_PAY_LIFE_INS,I have to pay my life insurance with a new credit card
INFO_PAY_LIFE_INS,Make payment for life coverage
INFO_PAY_LIFE_INS,How to make payment on life insurance bill now
INFO_PAY_LIFE_INS,Id like to pay for my life insurance
INFO_PAY_LIFE_INS,how to make a life insurance payment
INFO_PAY_LIFE_INS,how do I pay my bill for life insurance
INFO_PAY_LIFE_INS,Walk me through paying my life policy bill
INFO_PAY_LIFE_INS,pay my life insurance policy bill
INFO_PAY_LIFE_INS,can i make a life insurance payment
INFO_PAY_LIFE_INS,How to pay life insurance
INFO_PAY_LIFE_INS,i need to pay my life insurance bill
INFO_PAY_LIFE_INS,i wanna pay life insurance payment
INFO_PAY_LIFE_INS,I need help paying my life insurance
INFO_PAY_LIFE_INS,Help me get my life insurance bill paid
INFO_PAY_LIFE_INS,Make a life insurance payment
INFO_PAY_LIFE_INS,can I pay for my life insurance now
INFO_PAY_LIFE_INS,Life insurance payment methods
INFO_PAY_LIFE_INS,I want to pay my life insurance bill
INFO_PAY_LIFE_INS,Im having trouble paying my life insurance bill
INFO_PAY_LIFE_INS,I would like to pay off my life insurance
INFO_PAY_LIFE_INS,How do I pay for my life insurance
INFO_PAY_LIFE_INS,Can you help me find out how to pay my life insurance bill
INFO_PAY_LIFE_INS,Ways to pay for life insurance policy
INFO_PAY_LIFE_INS,Is it possible to pay my life insurance online
INFO_PAY_LIFE_INS,can you show me how to pay my life insurance bill
INFO_PAY_LIFE_INS,How can I pay my insurance bill
INFO_PAY_LIFE_INS,Can I pay my bill for life insurance
INFO_PAY_LIFE_INS,I need to pay this life insurance bill can you tell me where to pay it
INFO_PAY_LIFE_INS,How can I pay my life insurance
INFO_PAY_LIFE_INS,I would like to pay my life insurance
INFO_PAY_LIFE_INS,How do I make a life policy payment
INFO_PAY_LIFE_INS,Hi Abby seems there was a problem with processing an autodraft for my monthly premium on a life insurance policies Can I make the payment online
INFO_PAY_LIFE_INS,I need to make life policy payment
INFO_PAY_LIFE_INS,My life insurance payment is due
INFO_PAY_LIFE_INS,i need help paying my life insurance bill
INFO_PAY_LIFE_INS,Make payment for life insurance policy
INFO_PAY_LIFE_INS,I need help paying for my life insurance now
INFO_PAY_LIFE_INS,Need to make life insurance payment
INFO_PAY_LIFE_INS,Methods for making payments on life insurance
INFO_PAY_LIFE_INS,Pay for life insurance policy
INFO_PAY_LIFE_INS,Can you help me to figure out how to pay this life insurance bill
INFO_PAY_LIFE_INS,Make a payment on life insurance
INFO_PAY_LIFE_INS,I need to pay my life insurance payment now
INFO_PAY_LIFE_INS,Can I pay my life bill
INFO_PAY_LIFE_INS,How do I pay my life insurance bill
INFO_PAY_LIFE_INS,Hi my name is Mae I got a loan on my policy and I want to know how I start making payment to pay on the loan
INFO_PAY_LIFE_INS,Is it possible to pay our American Family Life Insurance premium online I dont see it in our list of accounts
INFO_PAY_LIFE_INS,Submit payment for life insurance
INFO_PAY_LIFE_INS,Help me make a life payment
INFO_PAY_LIFE_INS,How do I make a payment on my life insurance
INFO_PAY_LIFE_INS,Pay my life insurance bill
INFO_PAY_LIFE_INS,What options do I have in order to make a payment on my life insurance
INFO_PAY_LIFE_INS,I want to make a payment on my life insurance
INFO_PAY_LIFE_INS,On the back of my life insurance billing statement is says I can go online to pay the bill I cant figure out how to do it
INFO_PAY_LIFE_INS,Pay life insurance bill now
INFO_PAY_LIFE_INS,I want to pay for my life insurance
INFO_PAY_LIFE_INS,Pay for my life insurance
INFO_PAY_LIFE_INS,What do I have to do to make a life insurance payment
INFO_PAY_LIFE_INS,WHere can I pay my life insurance
INFO_PAY_LIFE_INS,I would like to make a payment on my life insurance today
INFO_PAY_LIFE_INS,How to pay my life insurance monthly fee
INFO_PAY_LIFE_INS,Life insurance payment
INFO_PAY_LIFE_INS,I need help with paying my life insurance bill
INFO_PAY_LIFE_INS,can I make a payment towards my life insurance
INFO_PAY_LIFE_INS,How can I make a life insurance payment
INFO_PAY_LIFE_INS,I need to make a life insurance payment
INFO_PAY_LIFE_INS,Can you help my pay my life insurance
INFO_PAY_LIFE_INS,I wanna pay my life insurance
INFO_PAY_LIFE_INS,Is it possible that I can pay for my life insurance now
INFO_PAY_LIFE_INS,Pay life insurance
INFO_PAY_LIFE_INS,Pay life insurance bill
INFO_PAY_LIFE_INS,Id like to pay my life insurance bill
INFO_PAY_LIFE_INS,Can I pay my life insurance policy
INFO_PAY_LIFE_INS,I would like to pay for my life insurance policy but its not online
INFO_PAY_LIFE_INS,Can you take me to the website to pay my life insurance
INFO_PAY_LIFE_INS,Please let me pay my life insurance bill
INFO_PAY_LIFE_INS,How to pay life insurance bill online
INFO_PAY_LIFE_INS,I dont know how to pay my life insurance bill I need help
INFO_PAY_LIFE_INS,can I pay my life bill online
INFO_PAY_LIFE_INS,Make payment for my life policy bills
INFO_PAY_LIFE_INS,How can I pay my life insurace online
INFO_PAY_LIFE_INS,I would like to make a life insurance payment
INFO_PAY_LIFE_INS,Submit life insurance coverage payment online
INFO_PAY_LIFE_INS,no I do not want to stop paying I WANT to pay online for a life insurance policy I have everything else set up online car home
